{
  "$schema": "http://json-schema.org/draft-07/schema#",
  "$id": "https://github.com/QSong-github/DR100/raw/main/schema/dr100_schema.json",
  "title": "DR100 Resource Record",
  "description": "Schema for one record of the DR100 resource table (registry/*.json).",
  "type": "object",
  "required": ["name", "category", "type", "subcategory", "paradigm", "description", "link"],
  "additionalProperties": false,
  "properties": {
    "name": {
      "type": "string",
      "description": "Canonical resource name.",
      "minLength": 1
    },
    "aliases": {
      "type": "array",
      "description": "Alternative names, abbreviations, or version-specific identifiers.",
      "items": { "type": "string" },
      "default": []
    },
    "category": {
      "type": "string",
      "description": "Primary category, by how directly the resource concerns drugs. Drug-centric: focuses directly on drugs. Drug-related (stored as Drug-related (indirect)): broader biological or clinical information that also includes drugs. Auxiliary (stored as auxiliary): general biomedical information or evaluation material not specific to drugs.",
      "enum": ["Drug-centric", "Drug-related (indirect)", "auxiliary"]
    },
    "type": {
      "type": "string",
      "description": "Resource type: knowledge graph (KG), database (DB), or dataset.",
      "enum": ["DB", "Dataset", "KG"]
    },
    "subcategory": {
      "type": "string",
      "description": "Content subcategory within the primary category (32 distinct labels in the current table)."
    },
    "paradigm": {
      "type": "string",
      "description": "Knowledge consumption mode in the Review. LLM-Friendly: information can mainly be interpreted after retrieval. Tool-Mediated: specialized computation is needed first.",
      "enum": ["LLM-Friendly", "Tool-Mediated"]
    },
    "pathway": {
      "type": ["string", "null"],
      "description": "Main knowledge interface in the Review (historical field name). Direct Prompt = Direct Prompting, RAG = Retrieval-Augmented Generation, Graph Query = Graph Queries, REST = Structured REST APIs, Computational = Computational Tool Invocation, Hybrid = Hybrid Interfaces. Null when unassigned.",
      "enum": [
        "Direct Prompt",
        "RAG",
        "Graph Query",
        "REST",
        "Computational",
        "Hybrid",
        null
      ]
    },
    "identifier": {
      "type": ["string", "null"],
      "description": "Main identifier system recorded for the resource ('name only' when no structured identifier was recorded). Null when unassigned.",
      "examples": [
        "DrugBank ID", "ChEMBL ID", "PubChem CID", "RxNorm", "ATC",
        "InChIKey", "SMILES", "CAS", "NDC", "UNII", "UMLS CUI",
        "ChEBI ID", "MeSH UI", "KEGG ID", "TTD ID", "NSC ID",
        "HMDB ID", "GSE ID", "LINCS ID", "UniProt", "DrugCentral ID",
        "IUPHAR ID", "name only"
      ]
    },
    "access": {
      "type": ["string", "null"],
      "description": "Main access approach recorded for the resource. Null when unassigned.",
      "enum": [
        "Open API",
        "Open Download",
        "Academic API",
        "Academic Download",
        "Web Only",
        "Commercial",
        null
      ]
    },
    "license": {
      "type": ["string", "null"],
      "description": "License class (when known). Free-text since licenses vary widely.",
      "default": null
    },
    "update_cadence": {
      "type": ["string", "null"],
      "description": "Resource update status. Periodic Recent, Moderate, and Stale correspond to about one year, one to two years, and two to five years since the last update; Static marks a deliberately fixed release. Null when unassigned.",
      "enum": [
        "Continuous",
        "Periodic Recent",
        "Periodic Moderate",
        "Periodic Stale",
        "Abandoned Static",
        "Static",
        null
      ]
    },
    "task_tags": {
      "type": "array",
      "description": "Task tags, recorded for Drug-centric resources only. T1 identification, T2 labeling, T3 mechanism, T4 safety, T5 drug-drug interaction, T6 target binding, T7 response, T8 repurposing, T9 combination.",
      "items": {
        "type": "string",
        "enum": [
          "T1", "T2", "T3", "T4", "T5", "T6", "T7", "T8", "T9"
        ]
      },
      "uniqueItems": true,
      "default": []
    },
    "task_tags_verified": {
      "type": "boolean",
      "description": "True for broad knowledge bases whose task tags were checked individually."
    },
    "aim": {
      "type": ["string", "null"],
      "description": "Short statement of the resource's primary purpose."
    },
    "source": {
      "type": ["string", "null"],
      "description": "Underlying data sources / curation provenance."
    },
    "description": {
      "type": "string",
      "description": "Full descriptive paragraph for the resource.",
      "minLength": 10
    },
    "link": {
      "type": "string",
      "description": "Primary URL for accessing the resource.",
      "format": "uri"
    },
    "paper_link": {
      "type": ["string", "null"],
      "description": "DOI or URL to the canonical citation paper.",
      "format": "uri"
    },
    "data_quality": {
      "type": "string",
      "description": "Status label from the construction script. authoritative: exact name match with accepted annotations. needs_review: approximate or missing name match, or default-looking annotations. Describes the construction process, not an independent validation.",
      "enum": ["authoritative", "needs_review"],
      "default": "authoritative"
    },
    "notes": {
      "type": ["string", "null"],
      "description": "Free-text curator notes."
    }
  }
}
