[
  {
    "name": "ClinicalTrials",
    "category": "Drug-related (indirect)",
    "type": "DB",
    "subcategory": "Clinical Trials",
    "paradigm": "LLM-Friendly",
    "pathway": "RAG",
    "identifier": "name only",
    "access": "Open Download",
    "license": null,
    "update_cadence": "Periodic Moderate",
    "task_tags": [],
    "aim": "Clinical trial registry and results",
    "source": "NIH / ClinicalTrials.gov submissions",
    "description": "ClinicalTrials.gov is the world's largest clinical trial registry, containing protocol and results data for federally and privately funded studies on human health interventions including drug trials worldwide.",
    "link": "https://clinicaltrials.gov/data-api/api",
    "paper_link": "https://doi.org/10.1056/NEJMsr1611785",
    "data_quality": "needs_review",
    "notes": null
  },
  {
    "name": "OncoKB",
    "category": "Drug-related (indirect)",
    "type": "KG",
    "subcategory": "Cancer Genomics",
    "paradigm": "LLM-Friendly",
    "pathway": "RAG",
    "identifier": "name only",
    "access": "Open Download",
    "license": null,
    "update_cadence": "Periodic Moderate",
    "task_tags": [],
    "aim": "Oncology variant-drug evidence database",
    "source": "Expert curation of oncology literature",
    "description": "OncoKB is a precision oncology knowledge base providing expert-curated evidence on the oncogenic significance of individual mutations and their therapeutic implications, with an FDA-recognized evidence level system.",
    "link": "https://www.oncokb.org/",
    "paper_link": "https://doi.org/10.1200/PO.17.00011",
    "data_quality": "needs_review",
    "notes": null
  },
  {
    "name": "TrialPanorama",
    "category": "Drug-related (indirect)",
    "type": "Dataset",
    "subcategory": "Clinical Trials",
    "paradigm": "LLM-Friendly",
    "pathway": "RAG",
    "identifier": "name only",
    "access": "Open Download",
    "license": null,
    "update_cadence": "Periodic Moderate",
    "task_tags": [],
    "aim": "Clinical trial data for NLP/AI benchmarking",
    "source": "ClinicalTrials.gov, FDA, WHO ICTRP",
    "description": "TrialPanorama is a comprehensive clinical trial dataset curated for AI/NLP research, providing structured trial metadata including eligibility criteria, interventions, outcomes, and results across global trial registries.",
    "link": "https://huggingface.co/datasets/TrialPanorama/TrialPanorama-database",
    "paper_link": "https://arxiv.org/html/2505.16097v1",
    "data_quality": "needs_review",
    "notes": null
  },
  {
    "name": "ChemProt",
    "category": "Drug-related (indirect)",
    "type": "Dataset",
    "subcategory": "Chemical NER/RE",
    "paradigm": "LLM-Friendly",
    "pathway": "RAG",
    "identifier": "name only",
    "access": "Open Download",
    "license": null,
    "update_cadence": "Periodic Moderate",
    "task_tags": [],
    "aim": "Chemical-protein interaction relation extraction",
    "source": "PubMed abstracts, manual annotation",
    "description": "ChemProt is a BioCreative VI benchmark dataset for extraction of chemical-protein interactions from biomedical literature, providing annotated relations across 10 relation classes for NLP model evaluation.",
    "link": "https://huggingface.co/datasets/bigbio/chemprot",
    "paper_link": "https://pmc.ncbi.nlm.nih.gov/articles/PMC6348314/",
    "data_quality": "needs_review",
    "notes": null
  },
  {
    "name": "BioRED",
    "category": "Drug-related (indirect)",
    "type": "Dataset",
    "subcategory": "Chemical NER/RE",
    "paradigm": "LLM-Friendly",
    "pathway": "RAG",
    "identifier": "name only",
    "access": "Open Download",
    "license": null,
    "update_cadence": "Periodic Moderate",
    "task_tags": [],
    "aim": "Multi-entity biomedical relation extraction",
    "source": "PubMed full-text articles, manual annotation",
    "description": "BioRED is a rich biomedical relation extraction dataset with annotations for multiple entity types (chemical, gene, disease, variant, species) and multiple relation types across full-text PubMed articles.",
    "link": "https://ftp.ncbi.nlm.nih.gov/pub/lu/BioRED/",
    "paper_link": "https://doi.org/10.1093/bib/bbac282",
    "data_quality": "needs_review",
    "notes": null
  },
  {
    "name": "BC5CDR",
    "category": "Drug-related (indirect)",
    "type": "Dataset",
    "subcategory": "Chemical NER/RE",
    "paradigm": "LLM-Friendly",
    "pathway": "RAG",
    "identifier": "name only",
    "access": "Open Download",
    "license": null,
    "update_cadence": "Periodic Moderate",
    "task_tags": [],
    "aim": "Chemical/disease NER and relation extraction",
    "source": "PubMed abstracts (BioCreative V CDR task)",
    "description": "The BC5CDR corpus provides manually annotated chemical and disease named entities and chemical-disease induced relations in PubMed abstracts, widely used for NER and relation extraction benchmarking.",
    "link": "https://huggingface.co/datasets/bigbio/bc5cdr",
    "paper_link": "https://doi.org/10.1093/database/baw068",
    "data_quality": "needs_review",
    "notes": null
  },
  {
    "name": "CHEMDNER",
    "category": "Drug-related (indirect)",
    "type": "Dataset",
    "subcategory": "Chemical NER/RE",
    "paradigm": "LLM-Friendly",
    "pathway": "RAG",
    "identifier": "name only",
    "access": "Open Download",
    "license": null,
    "update_cadence": "Periodic Moderate",
    "task_tags": [],
    "aim": "Chemical entity NER benchmark",
    "source": "PubMed abstracts (BioCreative IV CHEMDNER task)",
    "description": "The CHEMDNER corpus provides annotated chemical entity mentions in PubMed abstracts, created for the BioCreative IV CHEMDNER task to benchmark chemical named entity recognition systems.",
    "link": "https://huggingface.co/datasets/bigbio/chemdner",
    "paper_link": "https://doi.org/10.1186/1758-2946-7-S1-S2",
    "data_quality": "needs_review",
    "notes": null
  },
  {
    "name": "PrimeKG",
    "category": "Drug-related (indirect)",
    "type": "KG",
    "subcategory": "Biomedical Knowledge Graph",
    "paradigm": "LLM-Friendly",
    "pathway": "RAG",
    "identifier": "name only",
    "access": "Open Download",
    "license": null,
    "update_cadence": "Periodic Moderate",
    "task_tags": [],
    "aim": "Precision medicine knowledge graph",
    "source": "Integrated from 20 biomedical databases",
    "description": "PrimeKG (Precision Medicine Knowledge Graph) is a multimodal knowledge graph designed for precision medicine, integrating disease biology, drug targets, and clinical outcomes from 20 curated databases to support therapeutic target identification.",
    "link": "https://github.com/mims-harvard/PrimeKG",
    "paper_link": "https://doi.org/10.1038/s41597-023-01960-3",
    "data_quality": "needs_review",
    "notes": null
  },
  {
    "name": "Hetionet",
    "category": "Drug-related (indirect)",
    "type": "KG",
    "subcategory": "Biomedical Knowledge Graph",
    "paradigm": "LLM-Friendly",
    "pathway": "RAG",
    "identifier": "name only",
    "access": "Open Download",
    "license": null,
    "update_cadence": "Periodic Moderate",
    "task_tags": [],
    "aim": "Biomedical heterogeneous network for drug repurposing",
    "source": "Integrated from 29 public databases",
    "description": "Hetionet is an integrative biomedical knowledge graph constructed from 29 databases with 11 types of entities including genes, compounds, diseases, pathways, and anatomies, widely used for drug repurposing and pathway analysis.",
    "link": "https://het.io/",
    "paper_link": "https://doi.org/10.7554/eLife.26726",
    "data_quality": "needs_review",
    "notes": null
  },
  {
    "name": "BioKG",
    "category": "Drug-related (indirect)",
    "type": "KG",
    "subcategory": "Biomedical Knowledge Graph",
    "paradigm": "LLM-Friendly",
    "pathway": "RAG",
    "identifier": "name only",
    "access": "Open Download",
    "license": null,
    "update_cadence": "Periodic Moderate",
    "task_tags": [],
    "aim": "General-purpose biomedical knowledge graph",
    "source": "Integrated from UniProt, STRING, SIDER, DrugBank, DisGeNET",
    "description": "BioKG is a large-scale, ready-to-use biomedical knowledge graph for link prediction and drug repurposing, integrating protein interactions, drug targets, disease associations, and side effects.",
    "link": "https://github.com/dsi-bdi/biokg",
    "paper_link": "https://dl.acm.org/doi/10.1145/3340531.3412776",
    "data_quality": "needs_review",
    "notes": null
  },
  {
    "name": "SPOKE",
    "category": "Drug-related (indirect)",
    "type": "KG",
    "subcategory": "Biomedical Knowledge Graph",
    "paradigm": "LLM-Friendly",
    "pathway": "RAG",
    "identifier": "name only",
    "access": "Open Download",
    "license": null,
    "update_cadence": "Periodic Moderate",
    "task_tags": [],
    "aim": "Multi-domain biomedical knowledge graph",
    "source": "Integrated from 41+ databases (UCSF)",
    "description": "SPOKE (Scalable Precision Medicine Open Knowledge Engine) is a comprehensive biomedical knowledge graph developed at UCSF, integrating diverse biological data across multiple domains to support precision medicine applications.",
    "link": "https://spoke.ucsf.edu/",
    "paper_link": "https://academic.oup.com/bioinformatics/article/39/2/btad080/7033465",
    "data_quality": "needs_review",
    "notes": null
  },
  {
    "name": "MSI (Multiscale Interactome)",
    "category": "Drug-related (indirect)",
    "type": "KG",
    "subcategory": "Biomedical Knowledge Graph",
    "paradigm": "LLM-Friendly",
    "pathway": "RAG",
    "identifier": "name only",
    "access": "Open Download",
    "license": null,
    "update_cadence": "Periodic Moderate",
    "task_tags": [],
    "aim": "Drug-disease network for repurposing",
    "source": "DrugBank, STRING, GO, Reactome, human interactome",